{"schemaVersion":"apollo.component-contract.v2.1-experimental","documentType":"component-contract","package":{"id":"web-core.switch","componentId":"web-core.switch","family":"Switch","library":"Web _ Core","sourcePath":"contract.manual.json","sourceGeneratedAt":"2026-10-22T22:21:47.096Z","sourceExportVersion":"component-contract-editor@0.2.64","snapshotProfile":"variant-facts-v4","generatedFactsHash":"8ef27fa6a06bc7a81a48f52f1223ba53bbf3979d8177a163a0c6f77141f230c3","manualSourceHash":"6b70848f7dbcd494700836d554127b063fad6619279235d0f9a47a136cb9161e"},"status":"draft","facts":{"variantEvidence":{"schemaVersion":"apollo.variant-anatomy.v1","sourceHash":"cfafbe7949a4cba2dbb7e9238ed380d619ff704f5708484989e96bc4fe88b335","structures":{"7e693705d75690674e2fc1d83b2a28ee804fc4d053cae72477f15ca19890dfe0":[{"path":"","type":"ROOT"},{"path":"area","type":"RECTANGLE"},{"path":"Oval","type":"VECTOR"}],"3e297de96223389f5ca4fbbd4b8ecea181111ec8548369bf8f5fa29fa9338103":[{"path":"","type":"ROOT"},{"path":"Content","type":"FRAME"},{"path":"Content / Label","type":"TEXT"},{"path":"Switch_20","type":"INSTANCE"},{"path":"Switch_20 / area","type":"RECTANGLE"},{"path":"Switch_20 / Oval","type":"VECTOR"}],"61b0e4df76b8055eec17c5807eb1ec31ec29322fb36f99571cba60ccaeeda8ca":[{"path":"","type":"ROOT"},{"path":"Content","type":"FRAME"},{"path":"Content / HintMessage","type":"TEXT"},{"path":"Content / Label","type":"TEXT"},{"path":"Switch_20","type":"INSTANCE"},{"path":"Switch_20 / area","type":"RECTANGLE"},{"path":"Switch_20 / Oval","type":"VECTOR"}],"8fec68266ac4933c2f0142167e7a6b5dc132646cfd9ad58f703e7c5be8e0aabe":[{"path":"","type":"ROOT"},{"path":"Content","type":"FRAME"},{"path":"Content / Label","type":"TEXT"},{"path":"Switch_20_Inverted","type":"INSTANCE"},{"path":"Switch_20_Inverted / area","type":"RECTANGLE"},{"path":"Switch_20_Inverted / Oval","type":"VECTOR"}],"119cb1fd09637e706cf4fc35f4778ddc3e623a741481fae05d20987a5634c9ac":[{"path":"","type":"ROOT"},{"path":"Content","type":"FRAME"},{"path":"Content / HintMessage","type":"TEXT"},{"path":"Content / Label","type":"TEXT"},{"path":"Switch_20_Inverted","type":"INSTANCE"},{"path":"Switch_20_Inverted / area","type":"RECTANGLE"},{"path":"Switch_20_Inverted / Oval","type":"VECTOR"}],"dcbd3fa20733beececb5bb4f31d7b5ebde3e26babc960b24c03258b82281f297":[{"path":"","type":"ROOT"},{"path":"Content","type":"FRAME"},{"path":"Content / Label","type":"TEXT"},{"path":"Switch_24","type":"INSTANCE"},{"path":"Switch_24 / area","type":"RECTANGLE"},{"path":"Switch_24 / Oval","type":"VECTOR"}],"85c4962d9800675d64dbc6f8515c5d17b7051a0dadd7ba6a7ed69e601fbfc894":[{"path":"","type":"ROOT"},{"path":"Content","type":"FRAME"},{"path":"Content / HintMessage","type":"TEXT"},{"path":"Content / Label","type":"TEXT"},{"path":"Switch_24","type":"INSTANCE"},{"path":"Switch_24 / area","type":"RECTANGLE"},{"path":"Switch_24 / Oval","type":"VECTOR"}],"114b33538d389ad80e9bd41108a9d570c5d99f57556f94bb829892fb1f0567a9":[{"path":"","type":"ROOT"},{"path":"Content","type":"FRAME"},{"path":"Content / Label","type":"TEXT"},{"path":"Switch_Inverted","type":"INSTANCE"},{"path":"Switch_Inverted / area","type":"RECTANGLE"},{"path":"Switch_Inverted / Oval","type":"VECTOR"}],"2ea907973250e474ae11edb218111112f2f85f75a6e24ba7722ce082764cbc21":[{"path":"","type":"ROOT"},{"path":"Content","type":"FRAME"},{"path":"Content / HintMessage","type":"TEXT"},{"path":"Content / Label","type":"TEXT"},{"path":"Switch_Inverted","type":"INSTANCE"},{"path":"Switch_Inverted / area","type":"RECTANGLE"},{"path":"Switch_Inverted / Oval","type":"VECTOR"}],"b7ec586e65f9e6a3fe6f3529e74faf1225e1d6d2b918571e34b45d8c67e38c65":[{"path":"","type":"ROOT"},{"path":"Content","type":"FRAME"},{"path":"Content / Label","type":"TEXT"},{"path":"Switch_24_Inverted","type":"INSTANCE"},{"path":"Switch_24_Inverted / area","type":"RECTANGLE"},{"path":"Switch_24_Inverted / Oval","type":"VECTOR"}],"fa8d209fadd1f1b64337655e915358a1b08f89ac960be969a4630ab6fbde0371":[{"path":"","type":"ROOT"},{"path":"Content","type":"FRAME"},{"path":"Content / HintMessage","type":"TEXT"},{"path":"Content / Label","type":"TEXT"},{"path":"Switch_24_Inverted","type":"INSTANCE"},{"path":"Switch_24_Inverted / area","type":"RECTANGLE"},{"path":"Switch_24_Inverted / Oval","type":"VECTOR"}]},"variants":[{"componentKey":"1a5815924c5cf1b34c56a5241b4e25b509c75e5c","componentSetKey":"e8701961b31778af4b80e0d621a1c7959ae0b6c5","structureId":"7e693705d75690674e2fc1d83b2a28ee804fc4d053cae72477f15ca19890dfe0","properties":{"SelectedState":"False","DisabledState":"True"}},{"componentKey":"52bd21ef3700cfeab6a8cf05a61767689e7e7eb2","componentSetKey":"e8701961b31778af4b80e0d621a1c7959ae0b6c5","structureId":"7e693705d75690674e2fc1d83b2a28ee804fc4d053cae72477f15ca19890dfe0","properties":{"SelectedState":"False","DisabledState":"False"}},{"componentKey":"64d42aed7a95504ab23cb9c28ef1cfee3efac6dc","componentSetKey":"e8701961b31778af4b80e0d621a1c7959ae0b6c5","structureId":"7e693705d75690674e2fc1d83b2a28ee804fc4d053cae72477f15ca19890dfe0","properties":{"SelectedState":"True","DisabledState":"True"}},{"componentKey":"6d536c3996ae0f7c1702dff8bbb5b943b512272f","componentSetKey":"e8701961b31778af4b80e0d621a1c7959ae0b6c5","structureId":"7e693705d75690674e2fc1d83b2a28ee804fc4d053cae72477f15ca19890dfe0","properties":{"SelectedState":"True","DisabledState":"False"}},{"componentKey":"7d84ab60509a5f3102d438465c3a5ea33f4588cc","componentSetKey":"279166f88adb7d8fc33feaa06d990ab57ce2048c","structureId":"7e693705d75690674e2fc1d83b2a28ee804fc4d053cae72477f15ca19890dfe0","properties":{"SelectedState":"False","DisabledState":"True"}},{"componentKey":"a8ae83d1fe96c429191d00e051a353b5938452bd","componentSetKey":"279166f88adb7d8fc33feaa06d990ab57ce2048c","structureId":"7e693705d75690674e2fc1d83b2a28ee804fc4d053cae72477f15ca19890dfe0","properties":{"SelectedState":"False","DisabledState":"False"}},{"componentKey":"eb97e2d23a14a3cddc8119a2d2c765f705237653","componentSetKey":"279166f88adb7d8fc33feaa06d990ab57ce2048c","structureId":"7e693705d75690674e2fc1d83b2a28ee804fc4d053cae72477f15ca19890dfe0","properties":{"SelectedState":"True","DisabledState":"True"}},{"componentKey":"a387185ff990bc2cec7c87698d1ec496d43b4f69","componentSetKey":"279166f88adb7d8fc33feaa06d990ab57ce2048c","structureId":"7e693705d75690674e2fc1d83b2a28ee804fc4d053cae72477f15ca19890dfe0","properties":{"SelectedState":"True","DisabledState":"False"}},{"componentKey":"88338562a779c5ce8848e2560c9f943335a1cf27","componentSetKey":"7ea79a8992bd08cef8a25815b143549983ef8a5a","structureId":"7e693705d75690674e2fc1d83b2a28ee804fc4d053cae72477f15ca19890dfe0","properties":{"SelectedState":"False","DisabledState":"True"}},{"componentKey":"a65f40e3d8b146e4ff5499b25871c37b8760fd2a","componentSetKey":"7ea79a8992bd08cef8a25815b143549983ef8a5a","structureId":"7e693705d75690674e2fc1d83b2a28ee804fc4d053cae72477f15ca19890dfe0","properties":{"SelectedState":"False","DisabledState":"False"}},{"componentKey":"606081638dd9a0efbc63ece465014d6c9f493f95","componentSetKey":"7ea79a8992bd08cef8a25815b143549983ef8a5a","structureId":"7e693705d75690674e2fc1d83b2a28ee804fc4d053cae72477f15ca19890dfe0","properties":{"SelectedState":"True","DisabledState":"True"}},{"componentKey":"a6e98fb2f8dcd0ed74e5e46b415fca95457092fa","componentSetKey":"7ea79a8992bd08cef8a25815b143549983ef8a5a","structureId":"7e693705d75690674e2fc1d83b2a28ee804fc4d053cae72477f15ca19890dfe0","properties":{"SelectedState":"True","DisabledState":"False"}},{"componentKey":"ab9a7a6c8d9bccafd4aa2a4b2f3f5db83888684d","componentSetKey":"3b466e00d6b12f79155c5ef3a2e3ad0ffe78f837","structureId":"7e693705d75690674e2fc1d83b2a28ee804fc4d053cae72477f15ca19890dfe0","properties":{"SelectedState":"False","DisabledState":"True"}},{"componentKey":"029a64060e6e3c202327b7cc11fcd0ad9a11dfdc","componentSetKey":"3b466e00d6b12f79155c5ef3a2e3ad0ffe78f837","structureId":"7e693705d75690674e2fc1d83b2a28ee804fc4d053cae72477f15ca19890dfe0","properties":{"SelectedState":"False","DisabledState":"False"}},{"componentKey":"622e74c9dfc4aa1fd4c123651c9145d66f8340b1","componentSetKey":"3b466e00d6b12f79155c5ef3a2e3ad0ffe78f837","structureId":"7e693705d75690674e2fc1d83b2a28ee804fc4d053cae72477f15ca19890dfe0","properties":{"SelectedState":"True","DisabledState":"True"}},{"componentKey":"bb762f486fa6d800813e53b9f2819a7d7784ea07","componentSetKey":"3b466e00d6b12f79155c5ef3a2e3ad0ffe78f837","structureId":"7e693705d75690674e2fc1d83b2a28ee804fc4d053cae72477f15ca19890dfe0","properties":{"SelectedState":"True","DisabledState":"False"}},{"componentKey":"2dad1288207b511a499cf9e067f1593d0aa8bf6a","componentSetKey":"847cd42e961511a0ea7a2b181e98dd9b569b528f","structureId":"3e297de96223389f5ca4fbbd4b8ecea181111ec8548369bf8f5fa29fa9338103","properties":{"Hint":"False","CompactLabel":"False"}},{"componentKey":"1508ca390dacba0781a02ad9c4bf596478827784","componentSetKey":"847cd42e961511a0ea7a2b181e98dd9b569b528f","structureId":"61b0e4df76b8055eec17c5807eb1ec31ec29322fb36f99571cba60ccaeeda8ca","properties":{"Hint":"True","CompactLabel":"False"}},{"componentKey":"217a93cb440c5c46adca15fe6a3db85aecb26f2b","componentSetKey":"847cd42e961511a0ea7a2b181e98dd9b569b528f","structureId":"3e297de96223389f5ca4fbbd4b8ecea181111ec8548369bf8f5fa29fa9338103","properties":{"Hint":"False","CompactLabel":"True"}},{"componentKey":"d88901712a303574543f85fa3baaa19e4407b538","componentSetKey":"847cd42e961511a0ea7a2b181e98dd9b569b528f","structureId":"61b0e4df76b8055eec17c5807eb1ec31ec29322fb36f99571cba60ccaeeda8ca","properties":{"Hint":"True","CompactLabel":"True"}},{"componentKey":"d326684a41dc042a5b6b6184b805b6681c1b12f9","componentSetKey":"204c011a6f0cf64dc8874c2e690e80613d435679","structureId":"8fec68266ac4933c2f0142167e7a6b5dc132646cfd9ad58f703e7c5be8e0aabe","properties":{"Hint":"False","CompactLabel":"False"}},{"componentKey":"eff34c29ea72f72ca698608fdc7c7234d0f3138b","componentSetKey":"204c011a6f0cf64dc8874c2e690e80613d435679","structureId":"119cb1fd09637e706cf4fc35f4778ddc3e623a741481fae05d20987a5634c9ac","properti